Rajasthan,Jaipur,Rambagh Palace ,94,302 005,"One of the most celebrated palace hotels, the Rambagh Palace is a fabulous building with wide corridors, arches, courtyards and shaded verandahs overlooking the immaculate gardens.    The 78 rooms and suites offer the latest of modern comforts in a period ambience. There are several restaurants, the legendary Polo Bar, indoor swimming pool and much more.",5,106,Top of the Line
Rajasthan,Jaipur,Samode Haveli,624,302 002,"A lovely old haveli set around a pleasant courtyard, just inside the Old City walls, built as a townhouse for the royal family of Samode. The rooms in the rambling building are well furnished with local hand-block printed fabrics and period furniture. The restaurant is decorated with exquisite frescoes. The pool area, with a bar and spa, is a very welcome area for relaxation. A genteel, luxurious option in Jaipur.",0,39,Superior hotel
Rajasthan,Jaisalmer,1st Gate Home Fusion,3203,345 001,"A refreshingly modern take on the traditional Jaisalmer haveli, this boutique hotel offers vibrant Rajasthani colours and motifs amid clean, uncluttered lines. You stay close to the fort, in cheerful rooms, with an award-winning restaurant and pleasant little public spaces.",NULL,NULL,Comfortable hotel
Rajasthan,Jaisalmer,Nachana Haveli,1344,345 001,"A 300-year-old sandstone mansion in the old part of Jaisalmer, Nachana Haveli has a lovely secluded courtyard with narrow corridors leading to rooms scattered throughout the building. The rooms vary in size but they are all full of character, furnished with lovely carved furniture and old paintings and relics. The rooftop Saffron restaurant has fine views of Jaisalmer Fort and is a popular gathering place in the evenings.",3,15,Standard hotel
Rajasthan,Jaisalmer,Suryagarh,3046,345 001,"Newly constructed, but built to resemble a proper Jaisalmer palace down to the golden-yellow sandstone, Suryagarh is a very luxurious option outside the main city. There is a variety of rooms and suites, eclectically decorated, and plenty of courtyards, restaurants and nooks in which to relax, along with a large swimming pool.",NULL,NULL,Superior hotel
Rajasthan,Jodhpur,Ajit Bhawan,15,342 006,"Ajit Bhawan is a lovely resort set in fabulous gardens, with a spectacular swimming pool. Winding paths lead to the attractive rooms, many with private sit-outs. All the suites, luxury tents and stylish rooms are air-conditioned and imaginatively furnished, mixing Raj splendour with a contemporary twist. There is a garden restaurant and a lounge bar with a historic atmosphere, and a large collection of vintage cars.",5,81,Comfortable hotel
Rajasthan,Jodhpur,Pal Haveli,2147,342 001,"A unique hotel in the heart of the old city of Jodhpur, with superb views over the city. Located close to the bottom of the majestic Meherangarh Fort, Pal Haveli is possibly the best place from which to admire the scope of this architectural feat.The haveli is a maze of courtyards, stone stairways, terraces and excellent carvings. The spacious guest rooms are delightfully furnished in the typical Rajasthani aristocratic style.",NULL,NULL,Standard hotel
Rajasthan,Jodhpur,Raas Jodhpur,2578,342 001,"Jodhpur's most innovative boutique hotel, stunningly situated at the foot of the mighty Meherangarh Fort, in the heart of the Old City. This luxurious hotel has a gorgeous swimming pool, a lovely spa, an atmospheric dining room, a cool cafe, and pretty terraces. Almost all the rooms and suites have fort views. They are highly sophisticated in their amenities and the decor is chic, contemporary and understated.",NULL,39,Superior hotel
Rajasthan,Jodhpur,Ratan Vilas,884,342 001,"Ratan Vilas is a charming family-run heritage hotel. A formal, circular drive leads you to the handsome sandstone building, built in 1920. With a pleasant front lawn and a lovely pool area, this is a calm oasis away from the old city. The large verandah leads to a nice and airy courtyard from where you access the guest rooms. All the rooms are spotlessly clean and tastefully decorated with antiques and block-print fabrics. ",0,20,Standard hotel
Rajasthan,Jodhpur,Umaid Bhawan Palace,118,342 006,"A splendid example of the Indo-colonial and art-deco style of the 1930s. It took 25 years and 3,000 men to build this, the largest and grandest private residence in the world. It is now a fabulous luxury hotel with 98 air-conditioned rooms and suites, a swimming pool, health club and facilities for tennis, billiards, horse riding and golf. It has a special multi-cuisine restaurant and trophy bar.",5,98,Top of the Line
Assam,Jorhat,Thengal Manor,2510,NULL,"The best place to stay in Jorhat is Thengal Manor, the colonial-era family home of one of Assam's leading planter families. The architecture with its colonnaded verandah, chandeliered sit-out overlooking lush lawns, fireplace and Louis XV furniture, is an immediate throwback to opulent Raj times. High ceilings, family photos, stately furniture, carpets and the stunning collection of art add atmosphere.",NULL,7,Comfortable hotel
West Bengal,Kalimpong,Holumba Haven,2224,734 301,"Holumba Haven is a family-run guesthouse with quaint wooden cottages in two acres of orchid farm and botanical garden. The owners export orchids species throughout the world. There is a delightful lawn, with hammocks and benches making this an ideal place for relaxation in a friendly and peaceful environment. Excellent home-cooked meals are served, but these must be ordered in advance.",NULL,19,Standard hotel
West Bengal,Kalimpong,Silver Oaks,1368,734 301,"A luxury boutique hotel in Kalimpong, which offers 25 rooms of great charm. Most of the spacious rooms are furnished with heavy original furniture. The ivy-covered building is set in landscaped gardens filled with orchids and ferns. The gardens slope down towards pine, rhododendron and magnolia trees. Views from the front lawn are superb, encompassing the entire Kalimpong valley and its environs.",0,25,Comfortable hotel
Madhya Pradesh,Kanha,Courtyard House,2733,NULL,"A small, comfortable and upmarket country retreat with lots of thoughtful touches. The lodge is built in the Indian style around a central courtyard, with alcoves and patio allowing guests to mingle or have privacy to relax and chill out. The rooms are large, well equipped and very comfortable. Dining takes place together around a large table where you can share your experiences of the day.",NULL,NULL,Standard hotel
Madhya Pradesh,Kanha,Kanha Earth Lodge,2700,481 111,"Kanha Earth Lodge is a luxurious, eco-friendly wildlife resort, tucked in a small hamlet not far from Kanha's Khatiya Gate. The very pleasant, characterful cottages are made from local materials, including waste wood, and offer a nice place to relax in after a game drive, and the cosy common lounge, bar and restaurant (using produce from their organic farm) make it a fun place to stay. ",NULL,NULL,Comfortable hotel
Madhya Pradesh,Kanha,Taj Banjaar Tola,2764,48111,"A luxurious jungle safari camp, the Taj Banjaar Tola features two campsites, each with its own swimming pool and dining areas. Gorgeous African-style tents, set beside the Banjaar River, offer great comfort in between safaris, with huge bathtubs, wooden decks, and tribal art and metalwork. A sumptuous safari experience.",NULL,NULL,Superior hotel
Rajasthan,Karauli,Bhanwar Vilas Palace,395,322 241,"Staying at Bhanwar Vilas Palace feels like stepping back in time. The impressive early-20th-century building has wide, cool verandahs, authentic period furniture and great ambience, with elaborately-furnished rooms. His Highness, Krishna Chandra Pal, often joins guests at dinner when he is in residence. The extensive hotel grounds also boast an old-fashioned swimming pool, a stable, vintage cars, and an organic garden. ",0,45,Standard hotel
Madhya Pradesh,Kathiwada,Kathiwada Raaj Mahal,3235,457 885,"This former hunting lodge, built in the 19th century, sits pretty amid 120 acres of private orchards. The suites have been restored but retain an old-world charm, and the common areas are studded with photographs and modern art, and particularly hunting memorabilia. The peaceful grounds are great for meditation and yoga, and the forests around are excellent for birding. A special stay in an undiscovered part of India.",NULL,NULL,Superior hotel
Assam,Kaziranga,Diphlu River Lodge,2513,NULL,"The spectacular Diphlu River Lodge is located on the banks of the Diphlu river, at the edge of the Kaziranga National Park. The large wooden cottages, all vernacular architecture on stilts, boast all necessary comforts and surround an attractive rice paddy.  There are several comfortable vantage points over the river to the National Park, where wildlife is often seen. This is the most luxurious base from which to explore Kaziranga, and to enjoy relaxation in comfortable surroundings between safaris.",NULL,NULL,Superior hotel
Assam,Kaziranga,Wild Grass Resort,87,785 109,"The oldest jungle lodge in Kaziranga, Wild Grass is located in a picturesque village close to the main entrance to the park. The rooms, in 2 tall blocks, have plenty of charm, with cane chairs and wooden furniture. There is a large dining room, with an inviting terrace overlooking the gardens. Wild Grass has its own dedicated team of knowledgeable naturalists, who accompany all excursions into the National Park.",0,36,Standard hotel
Madhya Pradesh,Khajuraho,Ramada Khajuraho,2638,471 606,"The Ramada has pleasant interiors of cool white-marble elegance with chandeliers in the lobby, curving white staircases, and well-chosen Indian antiques throughout. The modern rooms are decorated in soft cream shades and rich fabrics and have large bay windows, with views of either the central swimming pool, or the garden that surrounds the property, making this a peaceful place to relax.",5,85,Standard hotel
Madhya Pradesh,Khajuraho,The Lalit Temple View,2646,471 606,"Located 500 metres from the famous Khajuraho Temples, The Lalit is Khajuraho's premier hotel. Modern rooms offer touches of Indian culture and come fitted with large windows overlooking the garden or temples. The hotel features a spa, outdoor pool, fitness centre, massage services and sauna facilities, and yoga classes. A variety of international cuisine can be enjoyed throughout the day. The Mahua bar serves drinks.",5,47,Comfortable hotel
Rajasthan,Khempur,Ravla Khempur,2202,313 203,"Ravla Khempur is a grand, two-storey haveli, pale yellow in colour, with arched windows trimmed with ornate white carvings. This was the place where The Best Exotic Marigold Hotel was filmed. With a history dating to the early 17th century, the palace was once famed for its stable of fine Marwari horses and is still home to dancing stallions, which perform when requested in front of the magnificent turreted building.",NULL,NULL,Standard hotel
Kerala,Kochi,Ginger House Museum Hotel,3093,682 002,"In the heart of Jewtown, this eccentric hotel was built by an antique collector, who still has his main shop right next door, and many of the artefacts displayed in the hotel are for sale as well. It’s a spectacular place, with beautiful ceilings and art all over, a rooftop pool, a waterfront restaurant and a more formal indoor one. Exclusive, unique and characterful, It definitely lives up to its tag of museum hotel.",NULL,NULL,Comfortable hotel
Kerala,Kochi,Old Harbour Hotel,2294,682 001,"This is one of the true gems of Fort Cochin. Located only a street away from the waterfront and the famous Chinese fishing nets, the Old Harbour Hotel enjoys a superb location. The Old Harbour Hotel has characterful rooms, nooks and corridors dotted with antiques, and a beautiful poolside area in the shade of huge rain trees, perfect for relaxing with a beer.",NULL,28,Comfortable hotel
Kerala,Kochi,The Brunton Boatyard,979,682 001,"An excellent hotel situated at the historic site of a 19th-century boatyard. All rooms have a magnificent view of the busy shipping channel. The hotel has its own private jetty, which doubles up as a cafe overlooking the pool,  the garden and the sea. The hotel is right next to the Chinese fishing nets and close to the sights of Fort Cochin.",3,26,Superior hotel
Kerala,Kochi,The Fort House Hotel,2269,682 001,"The Fort House is one of the older establishments on the waterfront of Fort Cochin. This atmospheric property has undergone extensive renovation and now offers over twenty pleasant rooms. The restaurant on the waterfront is a big draw - not just for its location, but also its seafood specialties. Tourists as well as Kochi residents are regular visitors here, and they come to enjoy the evening views of the harbour.",NULL,NULL,Standard hotel
Kerala,Kochi,The Malabar House,980,682 001,"Over three centuries the Malabar House Residency in Fort Cochin served as a residence for wealthy traders and influential bankers. Now the new German owner has converted this heritage building into a small boutique hotel with 12 rooms, all furnished with select antique furniture and artifacts. Situated near the famous St. Francis Portuguese Church, it is now one of the most stylish boutique hotels in Cochin.",0,17,Superior hotel
Kerala,Kochi,The Tower House,2485,682 001,"The Tower House is an elegant boutique hotel housed in a historic Dutch building in the heart of Fort Cochin. Rooms have views over the park and the Chinese fishing nets along the coast. The Tower House is more like a grand old mansion rather than a hotel. It is a rambling bungalow with a roof of red tiles and a soothing whitewashed facade that conceals a well-tended lawn, a leafy courtyard and tasteful interiors.",NULL,13,Standard hotel
Tamil Nadu,Kodaikanal,Elephant Valley Eco Farm Hotel,2392,624 104,"Elephant Valley is a wonderful resort at the edge of the forest. The cottages have been tastefully created using local granite and reclaimed Burma teak wood, with interiors of colonial and art deco furniture. Set close to a reserve forest, you will find yourself surrounded by birds and beautiful trees, and might even spot elephants! Short and long hikes are easily possible, and there are both great views and great food.",NULL,NULL,Standard hotel
Nagaland,Kohima,Greenwood Villa,2829,NULL,"Greenwood Villa is a welcoming homestay, a little south of Kohima, on the foothills of Mt Japfu. Four simple but comfortable rooms in this family home are let out during the Hornbill Festival, and you have the chance to interact with the family, who are very helpful and informative about the region.",NULL,NULL,Standard hotel
Nagaland,Kohima,Niraamaya Retreats Aradura,3232,797 005,"Overlooking verdant pine forests, Niraamaya Retreats Aradura offers a countryside escape amidst some of the most beautiful scenery in the region. A stone building with comfortable, wood-floored rooms, this is a good option for exploring Kohima, with a pleasant lounge to return to.",NULL,NULL,Comfortable hotel
West Bengal,Kolkata,Calcutta Bungalow,3225,700 004,"In the heart of the Bengali part of the city that the British referred to as Black Town, is a restored 1920s townhouse, representative of a golden era in Calcutta's architecture. The delightful rooms are colourful and sprinkled with antiques, and there's a cosy common area and cafe. A great way to explore Kolkata's vibrant past - while living it at the same time!",NULL,NULL,Comfortable hotel
West Bengal,Kolkata,The Elgin Fairlawn,1866,700 016,"A charming relic of the Raj, this old-fashioned Calcutta institution is a rambling place filled with memorabilia, family heirlooms, paintings, well-stocked bookshelves and sitting rooms. Here, guests are encouraged to eat together in a sociable atmosphere. The dining room even offers a full English breakfast in cosy colonial surrounds, and there are a number of cosy lounges.",0,19,Comfortable hotel
West Bengal,Kolkata,The Glenburn Penthouse,3227,700 071,"The Glenburn Penthouse is an elegant residence in the heart of historic Kolkata, with an exquisite collection of antique Bengal colonial furniture and artworks. The Penthouse has spectacular views of Kolkata's iconic landmarks, easily enjoyed from lovely common spaces with Glenburn's own estate tea. The spacious suites have four-poster beds, and an air of Raj-era elegance. There is a library, a sun deck, even an infinity swimming pool that looks across to the Victoria Memorial.",NULL,NULL,Superior hotel
West Bengal,Kolkata,The Oberoi Grand,796,700 013,"The city of Calcutta has a number of noteworthy buildings of great beauty, and the Oberoi Grand is one of them. This Victorian landmark is located near the very heart of the buzzing city. The rooms and suites are the ultimate in old-world elegance and luxury. The Oberoi Grand has three exclusive restaurants, a bar and a tea lounge. Other facilities include a 24-hour business centre, a swimming pool, a health club and a gym.",5,213,Superior hotel
West Bengal,Kolkata,The Rajbari Bawali,3229,700 137,"The zamindars or landed gentry of Bengal led a lavish life full of wealth and privileges, building impressive mansions and temples. One such mansion is the Rajbari Bawali, over 250 years old and now a very comfortable heritage hotel, with gorgeous four-poster beds, etched mirrors and beautiful common areas (including a swimming pool) in an olde-worlde setting near the Hooghly River.",NULL,NULL,Comfortable hotel
Uttaranchal,Kotnaikana,Jhakersm Village House,3253,263 623,"In the midst of oak, rhododendron, pine, and deodar forest is a painstakingly renovated old house, now a two-bedroom homestay that's a treat for nature lovers.",NULL,NULL,Standard hotel
Kerala,Kovalam,Niraamaya Retreats Surya Samudra Kovalam,986,695 521,"A very private and unique beach resort on a stunning cliff top location, south of Kovalam. Beautiful, lush grounds and huge trees envelop lovely, tastefully furnished rooms, several of them original Kerala wooden houses. Bathrooms are among banana plants in open courtyards. The resort has an extraordinary swimming pool cut into a rock, overlooking the secluded beach. Great dining options, an elaborate spa, privacy and great service make it an upmarket, exclusive stay in Kovalam.",0,13,Superior hotel
Kerala,Kovalam,The Travancore Heritage,2053,695 501,"The Travancore Heritage is a seaside resort set in 8 acres of lush green coconut gardens south of Kovalam. The resort stands on a high cliff overlooking the Arabian Sea and a long, wide beach of powdery white sand. The charming cottages have elements of the traditional timber houses with tiled roofing. There is a swimming pool, Ayurveda centre, a seafood grill and a multi-cuisine restaurant.",NULL,NULL,Comfortable hotel
Kerala,Kumarakom,Coconut Lagoon,216,686 563,"Coconut Lagoon is a delightful top-end resort, adjacent to Vembanad Lake bird sanctuary. The resort can only be reached by a short boat ride. The air-conditioned cottages incorporate elements of traditional wooden houses and have an outdoor bathroom in a private courtyard. The resort has a large swimming pool and it also offers village expeditions, bird watching and backwater cruises.",0,42,Superior hotel
Tamil Nadu,Kumbakonam,Indeco Swamimalai (Anandham),1443,612 302,"Indeco Swamimalai is less a hotel and more a cross between a cultural village and an eccentric, wonderful museum. The reception building is an old lighthouse, transferred stone by stone from Chennai, and now contains a museum of British-era artifacts, alongside many others around the property. The rooms are large and stuffed with curios, the vegetarian food is excellent, and there are plenty of activities available.   There are innumerable statues and artifact collections here, as well as a deer enclosure, a space for ducks, a special outdoor dining table with piped 'rain' for the summers, a swimming pool made to resemble a temple tank, and even the vast blue gate of the old Madras Central Jail!   ",0,NULL,Standard hotel
Tamil Nadu,Kumbakonam,Mantra Koodam,2999,612 105,"Near the temple town of Kumbakonam, Mantra Koodam is designed like an ‘agraharam’ - a characteristically Brahmin street lined with ‘illams’ (homes). The cottages are designed like traditional Tamil homes – with large verandahs, Athangudi floor tiles, ornate Burmese teak doors and open-to-air bathrooms. Strolling through the property, you will come across lush coconut groves, temple shrines and the occasional peacock.",NULL,NULL,Comfortable hotel
Uttar Pradesh,Kushinagar,The Imperial Kushinagar,2554,274 403,"This hotel is one of the best on the ""Buddhist Circuit"", and it is a pleasant surprise to find such a comfortable and well run property in such a remote area. The staff are very friendly and helpful. The chef is well versed in preparing dishes from throughout Asia to cater to the pilgrims from different Buddhist nations - we recommend asking him for the ""Thai Special Meal"" - delicious!",NULL,44,Standard hotel
Ladakh,Kyagar,Lchang Nang Retreat,2959,194401,"Lchang Nang Retreat is set amidst an orchard of elm, apricot, and apple trees, with the Siachen river rushing past its western boundary. The cottages, created in the local architectural style using mud, stone and poplar, all have a private garden and sit-out. The restaurant provides a wide array of dishes, and even spa treatments are available here, amid gorgeous views of the snow-capped Himalayas.",NULL,NULL,Comfortable hotel
Ladakh,Lamayuru,Hotel Moonland,3009,NULL,"A popular, small budget hotel, run by a very friendly local family. The rooms are spacious and clean with attached bathroom and hot water is available. There is a nice garden in front of the hotel and you can get a good view of Lamayuru Monastery from the common terrace (especially worth seeing at sunset).",NULL,NULL,Standard hotel
Ladakh,Leh,Nimmu House,3246,194 101,"Nimmu House is a charming eco-resort nestled at 10,000 feet in the village of Nimmoo, 35km outside Leh. It is both a wellness retreat (offering yoga and spa therapies), and a great base to explore the Leh valley, with both traditionally-styled rooms and luxury tents in a beautiful orchard. The main building once belonged to a cousin of the Ladakhi king, and has been restored to offer cosy lounges and a great restaurant.",NULL,NULL,Comfortable hotel
Uttar Pradesh,Lucknow,Lebua Lucknow,3176,226 001,"This is a beautiful luxury hotel, designed as a large bungalow with lush green lawns, 1900s Art Deco architecture and a charming feel, perfect for the olde-worlde atmosphere of Lucknow.",NULL,NULL,Comfortable hotel
Karnataka,Madikeri,"Old Kent Resorts & Spa, Coorg",3186,571237,"Old Kent is located on a 200-acre plantation of coffee, pepper and cardamom in India. Built in 1864, Old Kent Lodge is perched at a vantage point within the estate. The verandah of the lodge offers a breathtaking view of the surrounding mountains. The spacious cottages, under a lush canopy of teak, rosewood and mahogany trees, combine luxury with colonial charm (including fitted Epsom-salt foot baths!).",NULL,NULL,Comfortable hotel
Tamil Nadu,Madurai,Heritage Madurai,2517,625 016,"This property was designed in the 1970s by renowned Sri Lankan architect Geoffrey Bawa as the Coat's Madurai Club. It has now been artfully renovated; the result is a hotel with lots of charm, and huge rooms. The restaurant serves Indian and international cuisine and there is a magnificent swimming pool to enjoy. There is also a 'heritage village', where you can see a potter at work, have some tea, and take a cooking class.",5,68,Comfortable hotel
Madhya Pradesh,Maheshwar,Ahilya Fort,2340,451 224,"Selected as one of the world's 101 best hotels by TATLER, the Ahilya Fort belonging to the Holkar dynasty of Indore, is a charming example of 18th-century Maratha architecture. Broad, dark wood beams, cool secluded rooms and sweet-smelling creepers welcome you and the wide views over the Narmada River and temples encourage you to linger. All meals are prepared using organic, home-grown vegetables.",NULL,NULL,Superior hotel
Assam,Majuli,Dekasang Lodge,2965,785 104,"Overlooking a tributary of the Brahmaputra, Dekasang Lodge offers modern comforts and amenities in traditional settings. The entire resort is built with organic materials and takes inspiration from the the surrounding rural and tribal areas. The rooms are airy and spacious with fully-equipped bathrooms.",NULL,NULL,Standard hotel
Tamil Nadu,Mamallapuram,Ideal Beach Resort,28,603 104,"Long a favourite in Mamallapuram, Ideal Beach Resort is situated right on the beach. The resort is designed as a series of cottages, each with its own balcony and verandah. There is also a large swimming pool surrounded by water gardens and flowering shrubs. The Sri Lankan owner runs an excellent restaurant with seafood specialties.",4,68,Standard hotel
Tamil Nadu,Mamallapuram,Taj Fisherman's Cove Resort & Spa,829,603 112,"A superior hotel, part of the Taj Group of Hotels. Located right on Covelong beach, 24km north of Mamallapuram, it has luxurious rooms, villas and cottages, an excellent seafood restaurant right by the water, a swimming pool, and tennis and badminton courts. There is very much a beach resort air here, with gently rolling lawns, palm trees, a lovely spa and plenty of spots to stretch out and relax.",5,80,Comfortable hotel
Rajasthan,Mandawa,Castle Mandawa,212,333 704,"Castle Mandawa is literally a castle in the centre of Mandawa, a maze of terraces, courtyards, narrow staircases and other intriguing elements. Sword-bearing guards welcome you at the gate; inside, the walls display 16th-century portraits of the Mandawa family and lovely frescoes. The rooms have period furniture, murals and alcoved sitting areas, and the fabrics are in bold colours. The dinners in the central courtyards or garden are dramatic, with dancers with lit torches.",0,80,Comfortable hotel
