Uttar Pradesh,Agra,The Coral Tree Homestay,2882,282 001,"This six-room home-stay is just a short walk away from the entrance to the Taj Mahal. The bright, cheerful rooms, verandahs and garden are all decorated with interesting pieces of art. The well-travelled owners are keen to interact with their guests, and are full of ideas to help you to get the most out of your time in Agra. ",NULL,NULL,Standard hotel
Uttar Pradesh,Agra,The Grand Imperial,2208,282 001,"This 100-year-old building is testimony to India's long and varied history. The low, white colonial building dating back to the Raj era is peppered with Mughal paintings and memorabilia, and was host at one time to the Crown Princes of England as well as to Mohammad Ali Jinnah. The wide lawn in the front, and the cupola-marked pool at the back complete the feel of a luxury heritage hotel.   ",4,30,Comfortable hotel
Uttar Pradesh,Agra,The Oberoi Amarvilas,1425,282 001 ,"One of India's most exclusive hotels, the Oberoi Amarvilas is the only hotel in Agra to offer unobstructed views of the Taj Mahal, merely 600 metres away. You have breathtaking views from throughout the complex - from the lobby, the restaurants, the bar, the swimming pool, and all of the sumptuous guest rooms and private balconies. Staying here is a memorable experience which will remain with you forever.",5,112,Top of the Line
Gujarat,Ahmedabad,The House of Mangaldas Girdhardas,2357,380 001,"The House of MG is a bastion of tranquility and early 20th-century charm against the swirling noise and colour of modern-day Ahmedabad. It has beautifully decorated rooms and a wonderful ambience. Located in the heart of the city, the House of MG is also the home to the perennially popular Agashiye, a rooftop restaurant that serves delicious traditional Gujarati food.",3,18,Comfortable hotel
Ladakh,Alchi,Zimskhang Hotel,2540,NULL,"This simple hotel is in the heart of the small village of Alchi, just 100 metres from the famous monastery. The 16 rooms are large and simply furnished, with en-suite bathrooms. There are few luxuries, though flat-screen televisions have recently been added, but in any case you may well prefer the view from the very pleasant garden restaurant.",NULL,NULL,Standard hotel
Kerala,Alleppey,Ameya Kerala,3242,NULL,"At Ameya, you'll find barefoot luxury on the backwaters of Kerala. Situated a little away from Kumarakom, it offers just four spacious cottages with large bathrooms around an infinity swimming pool, and guests can enjoy panoramic views of the lake from the cottages' elevated verandahs. Meals are served at various pleasant locations, and there are hammocks, grassy lawns, ayurvedic massages, yoga and plenty of birdlife to enjoy.",NULL,NULL,Comfortable hotel
Kerala,Alleppey,Emerald Isle,2308,688 511,"A wonderful old heritage home on Kerala's backwaters with a very friendly host who believes passionately in preserving his family's traditions. Time can be spent watching the toddy tappers climbing the tall trees, walking among the paddy fields or along the river banks, or rowing through the narrow canals in a country boat.",NULL,5,Standard hotel
Kerala,Alleppey,Kettuvallam (Houseboat),2337,NULL,"One of the most tranquil and relaxing things you can do in India is to cruise through the backwaters in a Kerala houseboat, known as a kettuvallam. There is an open sitting area where you can relax and watch the world go by, sipping from a tender coconut and enjoying the sheer peace of the surroundings. Freshly cooked Indian food and chilled beer make the experience even more enjoyable.",NULL,NULL,Comfortable hotel
Kerala,Alleppey,Vismaya Lake Heritage,2934,688 524,"Sitting on the edge of a peninsula, surrounded by three sides of the pristine Vembanad lake, Vismaya is a boutique 2-room hideaway, a 400-year-old royal house that has been completely restored and renovated by a Swiss architect. This is an airy refuge, meant for tranquil relaxation with great meals and breathtaking lake views all around. ",NULL,NULL,Superior hotel
Punjab,Amritsar,Ranjit Svaasa,2387,143 001,"This lovely heritage spa resort is located in the heart of Amritsar. The large lawns and ancient trees create a peaceful, idyllic space. The property is furnished with antiques and knick-knacks, and there are many delightful lounges, terraces, and places to relax. Each room is individually decorated, and most have an inviting patio or balcony overlooking the gardens. There is an inviting in-house spa as well.",4,18,Comfortable hotel
Maharashtra,Aurangabad,Vivanta By Taj - Aurangabad,819,431 003,"The Vivanta by Taj in Aurangabad is a low, sprawling white building with Mughal-style cupolas, arches, and even an onion-shaped dome. The hotel's rooms are set amongst lovingly landscaped and terraced lawns. The rooms are pleasantly appointed with all standard facilities. There is a 24-hour coffee shop, a multi-cuisine restaurant and a bar. For recreation, there is a swimming pool and a health centre.",5,40,Comfortable hotel
Karnataka,Badami,Krishna Heritage Hotel,3040,587 201,"Krishna Heritage is approximately ten minutes’ drive outside Badami. It offers spacious rooms, most with a balcony. The bathrooms are equally large and feature both indoor and outdoor showers. There is a small swimming pool. The restaurant has a good choice of Indian and Chinese food. Wifi is free and available in the reception.",NULL,NULL,Standard hotel
Uttar Pradesh,Bah,Mela Kothi - The Chambal Safari Lodge,3102,283 104,"Mela Kothi was once a 'camp office' for the aristocratic family of nearby Jarar, used when they organised the Bateshwar fair. It is now a comfortable eco-lodge run by the family, who are also conservationists, and this is a fabulous place for birders in particular. The suites and cottages are spread out under ancient trees, separated by pleasant lawns and tree-canopied pathways. Farm-to-table meals are served every day.  Once the farm for the local royal family, the Retreat still has an extensive organic vegetable garden, and the meals are served in different alfresco spots around the property. A great space to relax after days of culture and monuments!",0,NULL,Comfortable hotel
Gujarat,Balasinor,Garden Palace,1470,388 255,"A charming 19th-century mansion in a lovely garden setting. The drawing room has original French furniture amongst other period bric-a-brac, giving it a wonderfully period feel. The Nawabs of Balasinor were known for their hospitality, with kitchens famous for their distinctive Nawabi cuisine, and this is a great place to actually spend time with royalty in their own home.",0,NULL,Standard hotel
Madhya Pradesh,Bandhavgarh,Kings Lodge,2651,484 661,"A charming, rustic-feeling but upmarket lodge, set in a large, forested area. Designed to resemble the wattle-and-daub houses of local tribes, the lodge offers a generous lounge area, decorated with tribal motifs, nicely-sized cottages with sitouts (some on stilts), and a small swimming pool. The lodge has its own naturalists and a focus on eco-tourism, and the grounds are used well, with meals possible in various locations.",NULL,NULL,Comfortable hotel
Madhya Pradesh,Bandhavgarh,Nature Heritage Resort,2217,482008,"Nature Heritage Resort is a jungle lodge located in the lush green surroundings of Bandhavgarh National Park. Each of the air-conditioned cottages has its own personal verandah on which to relax. There is a thatched-roof restaurant where breakfast and lunch are served. The resort also has a swimming pool and spa. Evenings are a relaxed affair around the bonfire, where conversation is followed by a lavish dinner.",NULL,NULL,Standard hotel
Madhya Pradesh,Bandhavgarh,Samode Safari Lodge,2616,484 661,"Just as the Samode Palace in Rajasthan is one of the finest heritage places in India, the Samode Safari lodge is a very special jungle lodge. Guest accommodation is in luxurious individual lodges with villas and suites, decorated in tribal motifs. Two main lodges with spacious lounges open onto wooden decks for bird and wildlife sightings.  Zen in a tree-top setting.",NULL,NULL,Superior hotel
Karnataka,Bangalore,Laika Boutique Stay,3124,560 025,"Located off the buzzing MG Road, this is a friendly guesthouse in the heart of the city, close to Bangalore's major attractions. Laika offers aesthetically-designed air-conditioned rooms with antique furniture. Breakfast is included and served in the cosy dining area. Laika also maintains a library and can arrange cooking classes on request.",NULL,NULL,Standard hotel
Karnataka,Bangalore,St. Marks Hotel,3207,560 001,"St. Mark's Hotel, in the heart of Bangalore, is a 4-star boutique hotel, close to Brigade Road, and to several tourist attractions and shopping centres. A pleasant, modern hotel, St Mark’s has an airy feel, and has an indoor dining option known for its Indian food. The rooms are well made and comfortable - perfect after or before a long flight. There’s also a pleasant rooftop terrace for you relax with a coffee and snacks.",NULL,NULL,Comfortable hotel
Karnataka,Bangalore,The Taj West End,817,560 001,"A delightful hotel set in twenty acres of landscaped gardens, with a lot of old world charm that makes it feel more like a club. The luxurious rooms are in double-storeyed cottages, with a colonial feel, either overlooking the lush garden or the swimming pool. The hotel has a fitness centre, multiple restaurants and a flood-lit tennis court.",5,117,Superior hotel
Orissa,Baripada,The Belgadia Palace,3237,757 002,"If you are looking for an offbeat adventure that allows you to live like royalty, in a palace surrounded by art and experience culture, head out to The Belgadia Palace, home to the erstwhile royal family of Mayurbhanj. Two young sisters of this royal family have recently converted the palace into a beautiful boutique hotel, filled with unique pieces of furniture and furnishings. They promote sustainable travel in many different ways and engage with the guests to give them an opportunity to explore Mayurbhanj and its tribal people, and learn about their heritage and culture.",NULL,NULL,Comfortable hotel
Rajasthan,Barli,Fort Barli,2284,NULL,"A stay at Fort Barli is a delightful way to experience rural Rajasthan. Pretty much in the middle of nowhere, off the new highway between Jaipur and Udaipur, it offers an authentic Indian experience you can’t beat. Fort Barli is an intimate heritage hotel with a small number of beautiful rooms and charming lounges and courtyards, where you can relive the days of the Maharajas and explore the village and countryside in comfort.",3,11,Comfortable hotel
Madhya Pradesh,Barnagar,Fort Amla,2342,456 017,"The Fort Amla hotel belongs to a family that can trace its lineage back to the 8th century. This sprawling building of wide sweeping arches and open courtyards houses simple, cosy rooms. Your host is a great source of stories about this traditional village, where he is the unofficial banker, court of appeal and general go-to man for anything the villagers need, just as in medieval times (including childbirth advice!). ",NULL,NULL,Standard hotel
Rajasthan,Bera,Bera Safari Lodge,3234,306 126,"Run by a conservationist who saved the area from being given over to mining, Bera Safari Lodge is a collection of comfortable low-rise cottages, made from the handsome local stone. The lodge's main focus is leopards, which you can look for on jeep safaris into the Jawai Leopard Conservation Area, but you can also visit the Rabari shepherd villages, the Jawai dam (excellent for birding), and wander around on bicycles or on foot.",NULL,NULL,Comfortable hotel
Rajasthan,Bharatpur,Birders Inn,2241,321 001,"Located next to the entrance gate of the bird sanctuary, Birder's Inn is a quiet, peaceful haven with a friendly atmosphere, great for the keen birdwatcher. The spacious air-conditioned rooms overlook a garden with fruit trees that attract various birds. There is a large restaurant and a small swimming pool, and their naturalists are always available to accompany visits to the bird sanctuary.",NULL,NULL,Standard hotel
Rajasthan,Bharatpur,Laxmi Vilas Palace,860,321 001,"This large heritage hotel is the premier place to stay in Bharatpur. Laxmi Vilas is the older, 18th-century wing of the palace, with comfortable, well-furnished rooms. Between the two wings is an enticing swimming pool. The entire property is surrounded by extensive lawns giving it a rural and relaxing feel.",0,30,Comfortable hotel
Rajasthan,Bhenswara,Ravla Bhenswara,934,,"A traditional Rajput feudal homestead, this rambling structure has well-appointed rooms around a courtyard with a shimmering swimming pool. Off the main courtyard is the small but lavishly-decorated dining hall, where meals are served in buffet style. There is also a separate formal lounge with comfortable sofas. The garden area has small shrubs and trees and inviting benches for relaxation.",3,40,Standard hotel
Uttaranchal,Bhimtal,Fredy's Bungalow,3250,263 136,"This colonial-style homestead nestles among cypress and deodar trees, on a peaceful wooded hillside overlooking the Bhimtal valley. This peaceful, cosy haven is a birder's and butterfly-watcher's paradise, and a haven for writers seeking a retreat.",NULL,NULL,Standard hotel
Madhya Pradesh,Bhopal,Jehan Numa Palace Hotel,1455,462 013,"Built in 1890 and set in 5 sprawling acres, the Jehan Numa Palace Hotel is the beautifully-preserved erstwhile home of the rulers of Bhopal. The abundance of space has also allowed for airy rooms with large beds and stylish colonial furniture in dark wood. Unlike most city hotels, Jehan Numa boasts of wide balconies, open lawns, fountains and many inviting spots to relax and unwind after a day of sightseeing.",5,60,Comfortable hotel
Madhya Pradesh,Bhopal,Jehan Numa Retreat,3098,462002,"A beautiful resort that feels like a luxury wilderness retreat, while still being within Bhopal. Each large cottage has plenty of privacy, with a sitout and views over the semi-wild grounds (populated with plenty of birds). Once the farm for the local royals, the Retreat still has an extensive organic vegetable garden, and meals are served in different alfresco spots. A great space to relax after days of travel!",NULL,NULL,Comfortable hotel
Chhattisgarh,Bhoramdeo,Bhoramdeo Jungle Retreat,2937,491 995,"Nestled in the Maikal Hills, Satyendra ""Sunny"" Upadhyay's farm-stay is close to the famous Bhoramdeo temple complex. You can visit the temples, trek in the hills, or simply relax and enjoy the peace and delicious farm-grown food. However, the retreat's main focus is on real interaction with the gentle tribal people who live close by, in their tolas (villages), or while visiting the many colourful weekly haats (tribal markets).",NULL,NULL,Standard hotel
Orissa,Bhubaneswar,Mayfair Lagoon,1958,751 013,"Low-roofed, fat-pillared cottages, a spa and long courtyards make up this resort, built around a vast artificial lagoon. Graceful, statuettes and black-and-white photographs of Indian royals line the corridors leading to the sumptuous rooms. There are several dining options: a multi-cuisine restaurant, North and South Indian, an Italian cafe, a Scottish-themed bar, a Chinese restaurant, and a traditional Odia eatery. ",NULL,NULL,Comfortable hotel
Orissa,Bhubaneswar,The New Marrion Hotel,2257,751 001,"This old-fashioned but comfortable hotel is in an ideal location in the center of the city, close to the airport and railway station, with interesting markets nearby. The rooms are spacious and modern. There is a mosaic-tile swimming pool, a large restaurant with an extensive menu of Indian dishes, a smaller one specializing in continental food, a pastry shop/café, and a bar.",3,55,Standard hotel
Gujarat,Bhuj,The Bhuj House,2931,370 001,"The Bhuj House is a traditional Parsi courtyard house in the historic town of Bhuj. Built in the late 1800s, it has stood through seven generations of the Bhujwala family, and survived the devastating Bhuj earthquake of 2001. The family have lovingly restored the house, opening it as a delightful four-room heritage homestay.",NULL,NULL,Comfortable hotel
Rajasthan,Bijaipur,Castle Bijaipur,863,312 001,"Castle Bijaipur is a 16th-century castle with attractive domes and arched windows and doorways. The castle offers rooms of varying sizes and decor, simply furnished using local materials. There is a lovely swimming pool where you can relax. If you feel more energetic, you can explore the village, lakeside and nearby forts by cycle, horse or jeep, or go trekking in the surrounding hills.",0,24,Standard hotel
Rajasthan,Bikaner,Bhanwar Niwas,715,334 005,"A lovely pink sandstone haveli in the narrow winding streets of old Bikaner. Built in the early 20th century, the building is a fascinating combination of Indian and European styles with just a few large, richly furnished rooms, giving it a hushed, private feel. There are grand ceilings, stencils and friezes; the Blue Drawing room is in pale blue and gold leaf, the Grand Staircase in a riot of gold - you will be dazzled! ",0,28,Standard hotel
Rajasthan,Bikaner,Narendra Bhawan,3045,334 001,"The upmarket Narendra Bhawan Hotel was refurbished keeping in mind the times and life of the last reigning Maharaja of Bikaner, Narendra Singh. The building was painstakingly restored and modern amenities were added to welcome guests. It is now a chic heritage hotel with a beautiful ambience. There is now a roof-top pool, massive open courtyard, fascinating period-decorated rooms, and a lovely bar and restaurant.  ",NULL,NULL,Comfortable hotel
Uttaranchal,Binsar,Itmenaan Estate,3251,263 623,"Itmenaan Estate is a fairytale resort near Binsar, one of the most beautiful spots in the Kumaon Himalayas. The 10-acre resort includes virgin pine, oak and rhododendron trees and even a little natural spring. This restored 100-year-old house offers panoramic views of the Himalayas including the majestic Nanda Devi, and plenty of pleasant walks around - or just a delightful place to put your feet up and enjoy Kumaoni hospitality.",NULL,NULL,Standard hotel
Uttaranchal,Binsar,Mary Budden Estate,3245,NULL,"A true hideaway in the Himalayan foothills, secluded and exceptionally cosy. Mary Budden Estate is a couple of large stone and wood cottages from colonial times, converted into a relaxed, intimate resort with fabulous views and food in a setting of cedar, pine and rhododendron. A great spot if you like birding, easy treks or even just finding a good spot in the grounds or by the fire to enjoy a cuppa and a good book.",NULL,NULL,Comfortable hotel
Bihar,Bodh Gaya,Hotel Taj Darbar,2552,824 231,"This modern hotel is in a peaceful location, but is just a few minutes’ walk from the busy centre of Bodh Gaya. The 40 air-conditioned rooms are simply furnished, but are large, bright and clean - particularly the bathrooms. There is a welcoming lobby with friendly, helpful staff, and an excellent restaurant that offers food from around Asia, as the hotels caters to pilgrims from throughout the Buddhist world.",3,65,Standard hotel
Rajasthan,Bundi,Hotel Bundi Haveli,2214,323 001,"An old haveli turned into a small, chic guesthouse. Immaculate and gleaming in white, the haveli is built around a minuscule courtyard. Scalloped arches encircle the verandah restaurant and white walls set off a well-chosen collection of artefacts. The 10 tastefully furnished rooms are on the upper floors. The rooftop offers great views of the Palace complex, the hilltop Taragarh Fort beyond, especially at sunset. ",2,12,Standard hotel
Rajasthan,Chandelao,Chandelao Garh,868,342 006,"Chandelao Garh is a medieval fortified home converted by the sympathetic owner, Praduman Singh, into a lovely small, innovatively eco-friendly hotel. Praduman Singh has been involved in many welfare projects in his village, like the Sunder Rang crafts centre, run by village women. The rooms are traditional yet comfortable, and the food is locally grown. Staying here is a genuine eco-friendly rural experience.",0,20,Standard hotel
Rajasthan,Chanod,Hotel Chanoud Garh,2836,306 602,"This recently-restored palace offers a heritage homestay experience. The personable young owners will oversee every moment of your stay. They will show you round the property, including the museum-like Hall, and escort you to your sumptuous room. All meals are included, and are served in different atmospheric ""dining locations"". The owners also offer an intensive cookery class conducted by the mother of the house.",NULL,NULL,Superior hotel
Tamil Nadu,Chennai,Ramada Chennai Egmore,2720,600 008,"The Ramada Chennai Egmore is situated in the heart of Chennai. Renovated in 2012, the hotel has spacious, comfortable rooms that come with all the modern amenities and latest gadgets. The Board Walk rooftop restaurant has great cuisine and ambience. It has indoor and outdoor seating and has a swimming pool next to it, and you can also try the specialty seafood restaurant, Marina Sands.",5,113,Standard hotel
Tamil Nadu,Chennai,Taj Connemara,837,600 002,"The only heritage hotel in Chennai, with splendid art deco features, the luxurious, recently-renovated Taj Connemara Hotel is located downtown within walking distance of the city's shopping and commercial districts. With a lovely colonial feel, the Taj Connemara is Chennai's most atmospheric hotel, with a palm-lined swimming pool, excellent restaurants and a peaceful air.",5,148,Comfortable hotel
Meghalaya,Cherrapunji,Cherrapunjee Holiday Resort,2543,793 108,"The enthusiastic owners of this simple but spotlessly clean and comfortable small hotel have been instrumental in developing the tourist attractions around Cherrapunjee, in particular the well-maintained trekking paths to the spectacular living root bridges, for which they provide knowledgeable trekking guides. They also serve delicious and authentic local Khasi food, making this a perfect base for the adventurous traveller.",NULL,NULL,Standard hotel
Tamil Nadu,Chettinad,Chidambara Vilas,3191,622 505,"A splendid 19th-century mansion, Chidambara Vilas is full of the Burma teak pillars, Belgian chandeliers and other exotic touches that define the Chettinad houses. Walk through imposing courtyards, explore the roof with its wonderful views and enjoy the serene pool. The rooms are large and comfortable, with Balinese furniture, and make time for vast meals, central to the Chettiar tradition.",NULL,NULL,Standard hotel
Tamil Nadu,Chettinad,The Bangala,2376,630 001,"The Bangala, the Tamil pronunciation of 'The Bungalow', is an elegant boutique heritage hotel in a property that has been developed over the last 75 years. The hotel has comfortable, air-conditioned double bedrooms, with attached bathrooms, and a pleasant poolside area. The rooms are simply but elegantly furnished, and some have four-poster beds. The hotel has gained fame for its genuine home-cooked Chettinad food.",NULL,NULL,Standard hotel
Tamil Nadu,Chettinad,The Saratha Vilas,2990,630 105,"A lovely, low-slung Chettiar mansion restored by a pair of French architects, Saratha Vilas elegantly places traditional architecture alongside modern touches. The rooms are cosy and comfortable, there is a cooking class you can take part in, and the pool area is inviting - especially after a day of cycling round the villages of Chettinad.",NULL,NULL,Standard hotel
Tamil Nadu,Chettinad,Visalam,2332,630 103,"The beautifully polished traditional red terracotta floors are a highlight of this Chettiar mansion, as is the handcrafted teak wood furniture. The ceilings are lofty and the spaces uncluttered. The overall feel is definitely one of a home rather than a hotel, something reinforced by the warm and attentive service of the staff. A great place to catch your breath on a South India tour.",NULL,NULL,Comfortable hotel
Karnataka,Chikmagalur,Flameback Lodges,3238,577 132,"In a picturesque coffee plantation in hilly Chikmagalur is Flameback, a collection of cottages and villas separated by lush forest. Built to let you enjoy nature, the villas and suites have wide decks, jacuzzis and great views, and you have plenty of active options, from walking trails to birding, ATVs, jeeps, and local treks. Or you can simply enjoy the resort's pool, spa and great food, all in the midst of nature.",0,NULL,Comfortable hotel
Rajasthan,Chittaurgarh,The Padmini Haveli Guesthome,2778,312 001,"This delightful family-run homestay occupies an old haveli in a village within the walls of Chittaurgarh Fort. There are 8 charming air-conditioned rooms, with en-suite bathrooms built using local stone. Bicycles are available to explore the fort, and guests are encouraged to feel at home, and join in with the daily activities of the family, such as a cooking class in the family kitchen.",NULL,NULL,Standard hotel
Uttaranchal,Corbett,Jim's Jungle Retreat,3132,244 715,"A comfortable wildlife lodge, in which you can spend hours by the pool, at the jungle-inspired chemical-free spa or on your private verandah. The delightful, airy cafe and the restaurant serve organic farm-to-table meals, and their in-house naturalists can show you unique and fascinating aspects of the property, from medicinal plants to termite hills. Birdsong, privacy, and great meals are your personal luxuries here.",NULL,NULL,Comfortable hotel
Uttaranchal,Corbett,Tiger Camp,2814,NULL,"One of Corbett's older (and therefore less built-up) resorts, Tiger Camp has comfortable cottages hidden within a large garden with a lovely swimming pool and extensive lawns leading down to the Ramganga River. Buffet meals are served in the thatched roof restaurant. It is ideally located for safaris, being located close to both of the main park entry gates.",3,20,Standard hotel
