West Bengal,Darjeeling,Dekeling Hotel,2153,734 101,"Dekeling Hotel is a well-situated, friendly and comfortable hotel. Spotlessly clean and simple, this is the place to go for Tibetan hospitality in a Raj ambience. Tiled Victorian fireplaces and polished wooden floors are combined with bright Tibetan decorations. An old iron chimney heater keeps the lounge/library cozy and warm; it's a wonderful place to relax with a book.",2,19,Standard hotel
West Bengal,Darjeeling,Glenburn Tea Estate,3226,734 101,"Glenburn is a beautiful tea plantation retreat above the banks of the river Rungeet, high in the Himalayas, overlooked by the mighty Kanchenjunga mountain range. Established in colonial times, it now offers a vineyard-like tea experience, where you can learn about tea in relaxed luxury, with outdoor sitouts, tea tastings, walking trails, massage treatments, fishing and more, amid lovingly restored planter's bungalows.",NULL,NULL,Superior hotel
West Bengal,Darjeeling,The Elgin,1365,734 101,"A well-preserved Victorian mansion dating back to 1885, The Elgin has interiors that are dominated by teak floorboards covered with hand-made Tibetan rugs, comfortably over-stuffed armchairs, and crackling log-fires. The rooms are all charmingly designed with period furniture and many have marble bathrooms and open fire-places.",4,25,Comfortable hotel
West Bengal,Darjeeling,Windamere Hotel,1364,734 101,"The most celebrated of Darjeeling hotels, the Windamere has accommodated a pantheon of rich and famous guests. The Windamere has old-fashioned independent cottages with Raj-period furniture and crackling fireplaces lit at night. The hotel serves traditional English food at meal times and High Tea is accompanied by the hotel's string quartet. The cozy bar is beautiful too.",3,40,Superior hotel
Gujarat,Dasada,Rann Riders,2256,382 750,"Rann Riders is a resort featuring different types of traditional Gujarati and tribal homes set around well-kept lawns and shady trees. These mud, stone and tiled cottages are all furnished with modern comforts while preserving the essential rural feel of the homes. This eco-friendly resort is a good base from which to explore the salt plains and wetlands that form the Rann of Kutch.",2,17,Standard hotel
Delhi,Delhi,Andaz Delhi,3256,110 037,"A pleasantly informal upmarket hotel in Delhi airport's Aerocity, with a modern feel, lots of art and bright, airy spaces. The rooms are large, most with views over the runways (and with excellent noise-insulation!), offering a great spot to calm yourself before or after a long-haul flight. You'll find a couple of restaurants, a great gin bar, a large swimming pool and even a spa to take the sting out of international flights.",NULL,NULL,Comfortable hotel
Delhi,Delhi,Colonel's Retreat,3119,110 024,"Colonel's Retreat is a very pleasant and homely guest house in the upmarket, tree-lined neighborhood of Defence Colony. The large rooms are comfortable and artistically furnished. Each floor boasts a lovely lounge area with comfortable sofas for relaxing, books to read and borrow, and computers. A private rooftop dining area gives you a lovely view of the city.",NULL,NULL,Standard hotel
Delhi,Delhi,Haveli Dharampura,3217,110 006,"A beautifully restored old mansion in the heart of Old Delhi, Haveli Dharampura gives you a feel of the Mughal era. Each of the 13 rooms has two tales to tell, one of its history and the other of the restoration journey. There are two dining options, one with a beautiful rooftop view over medieval Old Delhi.",NULL,NULL,Comfortable hotel
Delhi,Delhi,Holiday Inn (Aerocity),3090,110 037,"For a comfortable stay before for after a long flight, the Holiday Inn at Aerocity, close to Delhi's International Airport, is ideal. The rooms are large, modern, and, most important of all, quiet. There is a swimming pool, a large restaurant with abundant buffets, a bar, and a speciality Italian restaurant. ",NULL,NULL,Standard hotel
Delhi,Delhi,The Claridges,1389,110 011,"A colonial building in a peaceful garden setting in the centre of Lutyens’ New Delhi. The lobby is light and airy whilst the air-conditioned rooms are spacious with all modern conveniences. There is a large swimming pool, a health club and a tennis court, and multiple, excellent restaurants. A pleasant superior hotel with old-world charm and a lovely location.",5,162,Superior hotel
Delhi,Delhi,The Imperial Hotel,116,110 001,"A delightful colonial hotel right in the centre of New Delhi. Set in tree-lined gardens with a swimming pool, the Imperial has an air of serenity and old-world opulence. The high-ceilinged rooms are furnished with classic pieces, with the flooring in wood and marble. A museum-quality collection of Raj-era art lines the corridors. In addition, The Imperial offers five excellent restaurants, and a large, historic bar.",5,263,Top of the Line
Delhi,Delhi,The Metropolitan Hotel,2782,110 001,"Located close to Connaught Place, in the centre of New Delhi, this quiet, upmarket hotel has a fresh atmosphere with vivid, minimalist, stylish designs. The hotel has 3 restaurants including one serving authentic Japanese cuisine. There is a swimming pool, an excellent large spa, a fashion & lifestyle store and an art gallery.",NULL,NULL,Comfortable hotel
Rajasthan,Delwara,Raas Devigarh,933,313 202,"The design of Devi Garh's interiors is completely contemporary, almost austere. You will not see the typical riot of colours associated with Rajasthan. The dominant colour here is white - of marble, of white on white plaster motifs on walls. Highly luxurious, the hotel offers rooms that are all different from each other, spectacular views from the many lounges, and a great spa. ",0,23,Superior hotel
Rajasthan,Deogarh,Deogarh Mahal,401,313 331,"One of Rajasthan's most spectacular palaces, Deogarh Mahal is a fabulous building of yellow ochre with ornate domes and white accents. The rooms are spread across the palace on different, maze-like levels. Many rooms have original furniture and some have exquisite frescoes and murals with mirrors. Beautiful handpicked fabrics enhance a feeling of quiet elegance. There is a well-designed swimming pool in its own secluded area.",3,50,Comfortable hotel
Himachal Pradesh,Dharamsala,Chonor House,1863,176 219,"This small, unique boutique guesthouse offers Upper Dharamsala's finest accommodation. Each of the rooms is uniquely themed according to different aspects of Tibetan culture. The furniture and murals offer a treasure chest of style and history. The hotel is in a great location, a short, though steep, walk from McLeod Ganj market and the Dalai Lama's temple, and next door to the Namgyal Monastery.",0,15,Comfortable hotel
Himachal Pradesh,Dharamsala,Norling Guest House Norbulingka,2424,176 219,"Norling Guesthouse is located within the Norbulingka Institute in Lower Dharamsala, a 20-minute drive from McLeod Ganj. This is a warm, cosy place with lovely Tibetan art, and the beautiful grounds of the Institute and temple around it. A comfortable guesthouse, this intimate place provides access to the sacred traditional art forms of Thangka painting, applique work and wood and metal work that are practised in the institute.",NULL,NULL,Standard hotel
Orissa,Dhenkanal,Dhenkanal Palace,3108,759 001,"The rambling old palace overlooking the town of Dhenkanal is wonderfully atmospheric. The rooms are scattered throughout the building, all with different décor and features. The whole place is filled with antiques, and there are several comfortable lounges in which to soak in the history. Time can be spent relaxing on the lawns, maybe in conversation with the erstwhile rulers of Dhenakanal, who still reside in the palace.",NULL,NULL,Standard hotel
Rajasthan,Dholpur,Raj Niwas Palace,3013,328 001,"The 19th-century Raj Niwas Palace in Dholpur was once home to generations of royals. The red sandstone palace has now been converted to a luxurious heritage hotel with spacious rooms, with decor going from Art Deco to opulently painted walls. Set in 13 acres of garden, the palace grounds are full of peacocks and bird life, and offer a serene base to explore the Chambal river and ravines.",NULL,NULL,Comfortable hotel
Assam,Dibrugarh,Mancotta Chang Bungalow,2509,786 005,"Set in lush gardens bordering an old tea estate, Mancotta Chang Bungalow is a wonderful heritage hotel just outside Dibrugarh. Mancotta Chang Bungalow has sloping green roofs, wraparound verandahs and an old-world elegance. The upper-level rooms are excellent with old wooden floors and period furniture. A traveler can easily spend quality time here sipping tea on the porch while looking out at the surrounding tea plantation.",NULL,6,Comfortable hotel
Tamil Nadu,Dindigul,Cardamom House,2391,624 701,"Cardamom House is owned by a retired British physician. The atmosphere is informal, and the daily activities of the house are tailored to accommodate the personal programmes of the guests. It is a small homestay with 6 double rooms and a suite which can also be divided into two separate rooms. All rooms are named after an Indian spice or herb, and all have superb views of Athoor Lake and the Western ghats.",NULL,NULL,Standard hotel
Diu,Diu,Radhika Beach Resort,941,362 520,"With double storied tile roofed villas surrounding a paved garden and swimming pool, this is generally considered the best hotel in Diu. It is located on Diu's best beach - Nagoa. The rooms are spacious and imaginatively done up. Radhika Beach Resort also features a swimming pool, health club and indoor games.",0,NULL,Standard hotel
Rajasthan,Dungarpur,Udai Bilas Palace,873,314 001,"A fabulous 19th-century palace overlooking a lake backed by green hills. Still the residence of the former royal family, there are beautiful guest rooms furnished with authentic period furniture. The beautifully-designed swimming pool borders the lake beyond and has some fabulous carved statuary around. The lake contains a small island, which houses the family temple of the owners of the palace.",3,23,Superior hotel
Sikkim,Gangtok,Netuk House,1367,737 101,"A member of the `Heritage Houses of the Himalayas', Netuk House is the old house of a prominent Sikkimese family, the Dengzompas. This small family-run hotel has 12 spacious, well-furnished rooms in ethnic Sikkimese style. All rooms have attached modern bathrooms. The hotel has fine views from the rooftop terrace, and a friendly and hospitable atmosphere.",0,10,Standard hotel
Sikkim,Gangtok,Nor Khill Hotel,1366,737 101,"A delightful hotel in a lovely garden, Nor-Khill used to be the royal guesthouse of the Chogyal dynasty. Now a warm and atmospheric hotel belonging to the Elgin group of Darjeeling, Nor-Khill has traditional decor. There are 30 rooms, all clean and comfortably furnished. The hotel offers good views over the countryside.",4,25,Comfortable hotel
Goa,Goa,Ahilya By-the-Sea,2877,403 109,"Tucked away in a quiet corner of Dolphin Bay, Ahilya by the Sea is a serene and private escape in Goa. The property’s tastefully decorated and welcoming rooms are spread across three independent villas and enjoy two beautiful swimming pools. The gardens are lush, and Ahilya offers an a la carte menu with elements of Goan, Italian, and French cuisines, with al fresco at a new spot every night.",NULL,NULL,Superior hotel
Goa,Goa,Alila Diwa Goa,2635,403 713,"This luxurious, sprawling hotel has great character. There is a wonderful sense of light and space, and an atmosphere of relaxation, from the high-ceilinged lobby, and the extensive lawns and grounds, to the large infinity pool overlooking the fields. The guest rooms are large and feature all modern comforts. The friendly staff will transfer you to and from nearby Majorda beach in the hotel's buggies whenever you wish.  ",NULL,NULL,Superior hotel
Goa,Goa,Cabo Serai,3259,403 702,"Apart from the beaches, Goa offers dramatic cliffs with spectacular views, on one of which perches the Cabo Serai resort. An eco-conscious resort, it tries to bring the outdoors in: the luxurious villas and tents offer excellent views and a natural, calming feel. Yoga and wellness are a big part of the stay, and birding is encouraged. Meals can be had in various spots around the property, from the beach to coconut groves.",NULL,NULL,Comfortable hotel
Goa,Goa,Casa Severina,2442,403 516,"A quiet and elegant retreat, this is an oasis of peace close to the bright lights of North Goa's busiest beach resorts. With a handful of rooms in an elegant low-rise building, this resort has classic Portuguese furniture – four-poster beds and elegant armchairs - and balconies overlooking the pool or the gardens. The famous Calangute beach is a mere five-minute walk away.",NULL,NULL,Standard hotel
Goa,Goa,Casa Susegad,3122,403 718,"This beautifully restored Portuguese-era colonial mansion has 5 comfortable and spacious guest rooms - the smaller ones have air conditioning, whereas the 2 larger rooms are kept cool by the high ceilings and large fans. All have sitouts, there is a swimming pool, a garden with hammocks, an area for yoga and meditation, and copious birdlife. The owners, staff and resident cats and dogs are all very friendly and welcoming! ",NULL,NULL,Standard hotel
Goa,Goa,Dwarka Eco Beach Resort,2354,403 702,"Dwarka is a very laid-back place - perfect for a few days of undisturbed relaxation. On the remote, unspoilt Kola Beach in South Goa, this small resort is draped over a terraced hillside. The comfortable rooms have colorful en-suite bathrooms and private balconies offering fabulous views over the beach and the lagoon. All meals are included in your stay, and are served in the open-air restaurant facing the beautiful beach.",NULL,NULL,Standard hotel
Goa,Goa,Elsewhere,2018,NULL,"A slim slice of pure paradise, the Elsewhere villas - the Captain's House, the Piggery, the Bakery and the Priest's House - straddle a narrow piece of land between the sea and a creek. The rustic villas sit well away from each other and house a world of comfort within. Their earthy coloured walls and fat white balustrades shelter lounge chairs and fluffy beds, right by one of the most beautiful beaches in Goa.",NULL,NULL,Superior hotel
Goa,Goa,Olaulim Backyards,2546,403 523,"Olaulim Backyards is located in one of Goa's most picturesque, peaceful spots. A small homestay, it offers fan- and breeze-cooled cottages made out of local bamboo, laterite stone and wood, over many lakeside acres. Natural boulders are kept intact and the beds are built around them, and the semi-outdoor bathrooms are delightful and well planned. Each room offers verandahs overlooking the forest or the lake. A lagoon-shaped pool, hammocks, kayaks and cycles offer plenty of active possibilities, watched over by a pony, dogs, and even a donkey! The meals are fresh and tasty, and the whole setup gives you a very different Goan experience. ",NULL,NULL,Standard hotel
Goa,Goa,Panjim Inn,2351,403 001,"A charming heritage hotel with lots of character, located amongst the winding alleys of Fountainhas, the Latin quarter of Panjim.The light-filled rooms are endowed with furniture worthy of any museum. The restaurant serves perennial Goan and Continental favourites. There are many sun-drenched balconies and shady courtyards for relaxation.",3,28,Standard hotel
Goa,Goa,Summertime,3008,403516,"A world away from north Goa's busy Calangute beach, but in reality only just a few kilometres, is an exceptional luxury three-bedroom villa that's a private sanctuary for the soul. Space and peace are the main luxuries, with huge bedrooms, a large infinity pool, beautiful gardens and even a waterfall-cum-koi-pond - all to yourself. Fabulous for families, birders, or just anyone who likes their holiday luxurious and peaceful.",NULL,NULL,Superior hotel
Goa,Goa,The Bay Agonda,2953,403 702,"The Bay Agonda offers the most stylish and comfortable accommodation at one of Goa's most desirable beaches. The River View cottages offer privacy and tranquil river views, while the Sea View Cottages (reached by a fun 2-minute journey in a small boat pulled by rope are set right on the beach. Rooms come with comfy beds, open-to-sky bathrooms, AC and sit-outs on which to read or just enjoy the view. ",NULL,NULL,Standard hotel
Goa,Goa,Wildflower Villas,2619,403 515,"Wildflower Villas is a boutique resort with rooms spread out among greenery on an eight-acre hill property in Saipem, just 7 minutes’ drive from the famous Candolim beach.The cottages are built like a Goan home, with a balcao and a large verandah. The resort also has a restaurant and large infinity swimming pool with stunning views over the Sinquerim River and Aguada Bay in the distance.",2,13,Comfortable hotel
Goa,Goa,Yab Yum Beach Resort,2441,403 527,"An ultra-stylish beach resort hidden behind one of the most beautiful beaches in Goa, Yab Yum (meaning ""the union of one"") is a peaceful resort consisting of domed and thatched creations surrounded by coconut trees. With its exciting, unique design and colours, the resort has its own style which defies a label, but is popular with those seeking out ""alternative"" aspects of Goa, such as yoga and meditation.",NULL,19,Standard hotel
Karnataka,Gokarna,Kahani Paradise,3115,581 326,"Just south of Goa is a beautiful luxury villa with terrific views over the Arabian Sea. Large rooms and bathrooms with lovely antiques, airy common areas, an infinity pool, a spa and stunning views are on offer here, with communal dining and plenty of scope for championship-level relaxation. An unusual stay option in a quiet part of the Western Indian coast, great for those who want a little indulgence.",NULL,NULL,Superior hotel
Karnataka,Gokarna,SwaSwara,2331,581 326,"SwaSwara is a luxury wellness resort by the beach in Gokarna, offering a range of ayurvedic treatments, healthy food, yoga and consultations in a comfortable, eco-conscious space. The villas are simply furnished but large and stylish, and offers views over the Arabian Sea. Seafood and wine are available, so staying here isn't a hardship, and you'll come away rejuvenated and with a newer, healthier outlook on life.",NULL,NULL,Superior hotel
Gujarat,Gondal,Orchard Palace,777,360 311,"A lovely palace with just seven guest rooms, set in a huge complex of fruit orchards, lawns and gardens. A delightful accommodation option is the beautifully restored Rail Saloon of the royal family! The ""room of miniatures"" is a splendid sitting room with a collection of miniature paintings, brass and antique furniture. The vast property also includes an impressive collection of classic and vintage cars.",0,7,Standard hotel
Orissa,Gopalpur-on-Sea,Mayfair Palm Beach Resort,2813,761 002,"A delightful upscale beach resort overlooking the Bay of Bengal, this is a great place to relax in comfort. There is a palm-filled garden with a swimming pool and cabanas for relaxing. Complimentary tea and snacks are served at sunrise and sunset in a kiosk overlooking the beach. All rooms are large, as are the bathrooms, many of which boast deep bathtubs, and each room has a balcony with comfortable ""day beds"" for relaxation.",NULL,NULL,Comfortable hotel
Karnataka,Gulbarga,Citrus Hotel Gulbarga by OTHPL,3258,585 103,"This modern, well-designed hotel is the best option in the town of Gulbarga (or Kalaburagi). Located close to both the railway station and a number of the tourist attractions, it's a clean, convenient and comfortable spot, with a multi-cuisine restaurant and a rooftop lounge, and well-appointed rooms with modern bathrooms.",NULL,NULL,Standard hotel
Madhya Pradesh,Gwalior,Deo Bagh,3027, 474 012,"A new hotel in Gwalior, though you wouldn't know it: the stone buildings and traditional decor are perfectly judged. The rooms are around a generous lawn, on the other side of which are the stunning cenotaphs and temple of the local aristocratic family: your own, private monuments to savour.",NULL,NULL,Standard hotel
Madhya Pradesh,Gwalior,Usha Kiran Palace,1381,474 009,"An understated and chic offering of the Taj Group of hotels, the Usha Kiran Palace was originally built in the 1930s to welcome the King and Queen of England. As you step into the manicured grounds it is clear that the palace is unique. Luxurious without being overpoweringly opulent, and sophisticated but not snobby, the Usha Kiran Palace will be a highlight of your visit to Gwalior.",5,28,Comfortable hotel
Karnataka,Hampi,"Evolve Back Kamalapura Palace, Hampi",2989,583 221,"A luxurious hotel built in the form of a palace in Hampi's Vijayanagara architectural style, Evolve Back Kamalapura Palace is by far the most upscale place to stay in Hampi. With very large suites (each with a private jacuzzi and bathtub), you get plenty of privacy and personalised service, and there are two restaurants (one offering local Bahmani cuisine), as well as private dining options. Explore Hampi in style! ",NULL,NULL,Superior hotel
Karnataka,Hampi,Hampis Boulders Resort,1989,NULL,"The resort is located a half-hour drive from Hampi's main sights, amidst a stunning location: you actually drive over large boulders to reach it! Spread over a large area leading down to the river, this is a unique place to stay. This private and remote resort is surrounded by nature, amid amid bamboo trees, coconut groves, mango trees, and the huge boulders that Hampi is famous for.",NULL,13,Comfortable hotel
Karnataka,Hampi,Uramma Heritage Homes,2717,583 227,"Across the river from Hampi, in the heritage village of Anegundi, is a small but prettily landscaped boutique property called Uramma Cottages. The attractive cottages look out onto the lawn, and are distinctively furnished using local fabrics. There is a restaurant serving excellent local dishes.    The friendly staff can take guests for a stroll around the village to see the various other eco-tourism initiatives which the owners of the hotel are involved in, such as a school, library, weaving centre, and craft centre. Mountain bikes are available to explore the surrounding villages and temples, or the ruins of Hampi.",NULL,7,Standard hotel
Uttaranchal,Haridwar,Devnadi - The Heritage Hotel,3037,249 401,"A wonderfully-restored art-deco mansion that once belonged to a princess of Nepal, this is now a small hotel, right on the banks of the Ganges, and a short walk away from Har Ki Pauri, the main ceremonial area. The rooms are highly atmospheric and high-ceilinged, with great views over the river. The hotel has a private bathing ghat, at which they conduct their own aarti ceremony every evening.",NULL,NULL,Standard hotel
Uttaranchal,Haridwar,The Haveli Hari Ganga,2058,249 401,"The Haveli Hari Ganga is situated on the banks of the holy river Ganges. This is a beautifully restored mansion, now a heritage hotel with well-appointed rooms. The restaurant serves excellent vegetarian food. There is a well-equipped ayurvedic spa, and the hotel offers many complimentary services, such as early morning yoga classes and an escort to the evening aarti ceremony. The hotel even has its own private bathing ghat.",4,20,Comfortable hotel
Andaman & Nicobar,Havelock Island,Barefoot at Havelock,2463,NULL,"An eco-sensitive hotel on one of the best beaches in Asia. Find yourself on pristine white sand, wandering between lovely thatched and wooden cottages, tents and villas spread out amid a tropical rain forest. A great spot for scuba diving, snorkelling, kayaking, jungle walks, or simply lazing about, with farm-to-table food, a spa and a lovely, relaxed ambience. ",NULL,NULL,Comfortable hotel
Gujarat,Hodka,Shaam-E-Sarhad Village Resort,2358,NULL,"The tribal people of Hodka, with the support of development agencies, built the Shaam-E-Sarhad Resort, using only local building materials and natural products used also in their own houses. You can visit different families to see their nicely decorated and painted mud houses, learn about their livelihoods and customs and admire their fine embroideries and leather works.",NULL,12,Standard hotel
Telengana,Hyderabad,Taj Banjara,1453,500 034,"An old-fashioned business hotel with character. Built in 1949, the hotel offers spacious rooms with comfortable furnishings. The coffee shop and kebab restaurant serve South Indian and North Indian food specialities, with a particular emphasis on regional cuisine.",0,NULL,Comfortable hotel
Telengana,Hyderabad,Taj Falaknuma Palace,2594,500 053,"The erstwhile residence of the Nizam of Hyderabad has now been converted by the Taj Hotels into a luxury heritage hotel. The palace offers unique rooms with 2 restaurants, an outdoor pool and the Jiva Spa, all with splendid architecture and decor. What was once the sole preserve of visiting royalty like King Edward VIII and the last Russian Tsar, Nicholas II, will now be yours to discover. We are sure the Royal family approve!",NULL,NULL,Top of the Line
Rajasthan,Jaipur,Alsisar Haveli,92,302 001,"Just off a busy street near the old walled city, Alsisar Haveli offers peace and serenity once you step through the arched gateway. Most of the aristocratic families, loyal to the royal house of Jaipur, maintained lavish town-houses in Jaipur. Alsisar Haveli is one such property. The current head of the family has sympathetically restored the old haveli, which now has a lovely swimming pool in a large, peaceful garden.",0,45,Comfortable hotel
Rajasthan,Jaipur,Dera Rawatsar,2130,302 016,"Dera Rawatsar is a family-run boutique hotel, warm as a home. Located just behind the bus station, Dera Rawatsar lies in a quiet, leafy lane. Within its walls are small courtyards and terraces, lawns and secluded corners. The well-decorated and traditionally-furnished rooms are all different. Meals, drinks and snacks are served in the family's dining room or the outdoor courtyard. There is also a small swimming pool.",3,19,Standard hotel
